{
  "schema_version": 1,
  "semantic_version": "0.91.0",
  "status": "reported",
  "updated_at": "2026-02-02T03:24:47Z",
  "artifacts": {
    "snapshots_dir": "snapshots/0.91.0",
    "reports_dir": "reports/0.91.0",
    "union_complete": false
  },
  "coverage": {
    "supported_targets": [],
    "supported_required_target": false
  },
  "promotion": {
    "eligible_for_latest_validated": false
  }
}
