{
  "schema_version": 1,
  "semantic_version": "0.98.0",
  "status": "reported",
  "updated_at": "2026-02-05T17:00:36Z",
  "artifacts": {
    "snapshots_dir": "snapshots/0.98.0",
    "reports_dir": "reports/0.98.0",
    "union_complete": false
  },
  "coverage": {
    "supported_targets": [
      "x86_64-unknown-linux-musl"
    ],
    "supported_required_target": true
  },
  "promotion": {
    "eligible_for_latest_validated": false
  }
}
